{
    "ksml_version": "0.1.0",
    "metadata": {
        "id": "123e4567-e89b-12d3-a456-426614174000",
        "author": "Min",
        "title": "Minimal",
        "created_at": "2023-01-01T00:00:00Z"
    },
    "configurations": {},
    "steps": [
        {
            "name": "S1",
            "action": "noop",
            "parameters": {}
        }
    ]
}